,0
159,great suvultimate suvkya khu iske bare test drive karo kud jaan jaowhat break system controlling power curvings built quality road head jeep company jo aisi suv banayi jitna khu utna kam read
160,great car great servicei bought limited diesel mohali dealership th january must say experience till great aspect confirmed purchase got delivery next day one day took banking formality amazing experience dealership mohali professional customer oriented even changed read
161,good car lack automatic transmissionmy friend recently bought jeep compass got small drive drove highway car felt well planted switch gear frequently order keep car moving made pretty relaxing drive came back city heavy clutch started get irritating painful th read
162,x mt compass l v awd tucson l compass come x cost atleast obviously new launch discount offer tucson discount offer l going available almost price x compass therefore tucson bigger powerful fuel efficient better dynamically designed read
163,jeep compass attractive suv miss key featuresi started following update small suv moment announced indian market key reason behind purchasing car attractive design fell love first sight since jeep product caring much build quality driving experience ride handling read
164,jeep worst car maker indiai purchased jeep compass limited th november delivery date th december within week vehicle breakdown nobody know happened road assistance service brought service center day proper solution far thing premium vehicle expected great service experience horrible read
165,jeep india worst sale team fake commitment deliver carvery disappointed jeep india dealer big brand poor management india fake data disclosing car delivered booking completed actual data wrong car road almost everyone waiting wasting time dealer initially promise deliver car first read
166,jeep compass great value money suv good back time writing review jeep compass longitude diesel mt mid segment jeep compass series start let tell vehicle absolutely solid heavy build give impeccable presence wherever go let talk engine dynamic diesel engine baby ltr read
167,truly urban jeep looking move good old mitsubishi outlander yes petrol suv diesel fan criterion suv chic look automatic petrol much choice available indian market shortlisted fortuner petrol tucson petrol read jeep launching petrol automatic thought give read
168,worst tyre jeep carsin india jeep car supplying good tyre car jeep compass car firestone tyre got bursted mysore city ride km aware read
169,multiple issuesbad experience far gear issue accompanied burning smell electronic parking brake failure le km even service team clueless
170,jeep compass unbelievably affordablei huge fan jeep badge sturdy macho vehicle american brand manufacture simply unmatchable following jeep compass since time first showcased massive road presence sharp styling compass suv cannot compared crossover country apart read
171,compass stayi bought jeep compass head turning look amazement compass lot offer ride quality sublime seating comfort although high door sill get way time especially hurry sound system amazing say infotainment display read
172,brand quality stylefirst version jeep compass worth money thing change look limited option onwards get feature one would like see compact suv price bit higher compared brand brand also matter sure people go compass look price buy brand quality read
173,x till november sun roofafter month waiting fr launch booked top end x first day booking opened going cancel booking reason delivery x till nov imminent increase tax road price go frm lac pay l fr top end vehicle still dummy button steering undersize read
174,small suvi saw jeep compass nearby dealership today smaller look image tucson comparison look wider sit inside quality material used good space also decent two six foot tall guy sit one behind look wide think driver read
175,good job jeeplooks interior soft touch leather touch screen harman kardon speaker safety feature comfortable seat low noise cabin led front nd rear light smooth drive read
